{
  "id":"practice-logic-02","title":"Crossing Before the Torch Dies","difficulty":4,"mode":"practice","categories":["logic-information-invariants","games-optimal-strategy"],"techniqueVisibility":"hidden-until-solution","sequence":4,
  "primaryTechnique":"information-strategy","secondaryTechniques":["state-modeling"],"prerequisites":[],"tags":["optimization","scheduling","riddle"],
  "problem":"Four people take 1, 2, 7, and 10 minutes to cross a narrow bridge. At most two can cross at once, a crossing takes the slower person's time, and the single torch must accompany every crossing. What is the minimum total time for everyone to cross?",
  "hints":[{"level":1,"text":"The two slowest people should cross together, but the torch-return costs must be managed carefully."},{"level":2,"text":"Compare using the two fastest people as shuttles with having the fastest escort each slow person separately."}],
  "solution":{"setup":"Use the 1- and 2-minute people to transport the torch while sending the 7- and 10-minute people together.","reasoning":"Send 1 and 2 across (2), return 1 (1), send 7 and 10 across (10), return 2 (2), then send 1 and 2 across again (2). Total: 2+1+10+2+2=17. For the two slowest, the best alternative escort plan costs 10+1+7+1=19 before completing the fast pair, so it cannot beat this schedule.","finalAnswer":"17 minutes","sanityCheck":"The 10-minute crossing is unavoidable. The remaining seven minutes account for moving both slow people in that crossing and restoring the torch while ultimately transporting the fast pair."},
  "keyInsight":"Optimize the expensive slow crossings and explicitly account for the return trips they force.","recognitionCues":["A transport puzzle with a shared resource requires comparing complete schedules, not greedily minimizing each individual move."],"commonMistakes":["Having the fastest person escort everyone separately, which seems natural but costs 19 minutes."],"followUps":["Derive when the two-fastest shuttle strategy beats the fastest-person escort strategy for general times a≤b≤c≤d."],
  "source":{"type":"original","notes":"Original wording of a classic bridge-scheduling problem."},"verification":{"status":"math-verified","method":"strategy-comparison-and-state-search","expectedValue":"17 minutes","notes":"The exhibited schedule costs 17; exhaustive legal-state search in scripts/verify_answers.py confirms optimality."},"reviewStatus":"approved"
}
