{"id":"practice-sym-02","title":"Ants on a Triangle","difficulty":3,"mode":"practice","categories":["symmetry-exchangeability","logic-information-invariants"],"techniqueVisibility":"hidden-until-solution","sequence":11,"primaryTechnique":"symmetry","secondaryTechniques":["counting-combinatorics"],"prerequisites":["basic-probability"],"tags":["directions","complement","riddle"],"problem":"An ant stands at each vertex of a triangle. Simultaneously, each independently chooses one of the two directions around the triangle with equal probability and walks to the next vertex. What is the probability that no two ants collide?","hints":[{"level":1,"text":"A collision is avoided only if all ants choose a consistent direction around the triangle."},{"level":2,"text":"There are 2^3 direction choices and two safe choices: all clockwise or all counterclockwise."}],"solution":{"setup":"Encode each ant's choice as clockwise or counterclockwise.","reasoning":"There are eight equally likely direction triples. If all go clockwise or all go counterclockwise, they rotate without collision. Any mixed choice sends two ants toward the same edge or vertex. Thus two outcomes are safe.","finalAnswer":"1/4","sanityCheck":"The two safe outcomes are symmetric and each has probability (1/2)^3=1/8."},"keyInsight":"Characterize globally collision-free motion before counting local direction choices.","recognitionCues":["Symmetric agents make independent binary choices on a cycle."],"commonMistakes":["Assuming each pair avoids collision independently."],"followUps":["Generalize to n ants on an n-gon."],"source":{"type":"original","notes":"Original wording of a classic directional puzzle."},"verification":{"status":"math-verified","method":"exhaustive-eight-case-check","expectedValue":"1/4","notes":"Only the two unanimous directions are safe."},"reviewStatus":"approved"}
