{"id":"practice-dist-01","title":"Which Coin Was Chosen?","difficulty":4,"mode":"practice","categories":["distributions-statistics","conditional-probability-bayes"],"techniqueVisibility":"hidden-until-solution","sequence":16,"primaryTechnique":"bayes-theorem","secondaryTechniques":["conditional-probability"],"prerequisites":["conditional-probability"],"tags":["likelihood","model-selection","coins"],"problem":"Choose one of two coins uniformly. Coin A lands heads with probability 3/4; Coin B is fair. The chosen coin produces H,H,H,T. What is the probability Coin A was chosen?","hints":[{"level":1,"text":"Compare the likelihood of the exact sequence under each coin."},{"level":2,"text":"The likelihoods are (3/4)^3(1/4) and (1/2)^4; equal priors make the posterior their normalized ratio."}],"solution":{"setup":"Let D be the observed ordered sequence HHHT. The prior odds are 1:1.","reasoning":"P(D|A)=27/256 and P(D|B)=1/16=16/256. Bayes' rule gives P(A|D)=27/(27+16).","finalAnswer":"27/43","sanityCheck":"Three heads favor A, while the tail prevents overwhelming evidence; the posterior around 0.628 is reasonably above one-half."},"keyInsight":"Posterior odds equal prior odds multiplied by the likelihood ratio.","recognitionCues":["Competing data-generating models and an observed sample call for likelihood comparison."],"commonMistakes":["Ignoring the final tail when computing Coin A's likelihood."],"followUps":["How would the posterior change after HHHH?"],"source":{"type":"original","notes":"Original Bayesian model-selection exercise."},"verification":{"status":"math-verified","method":"exact-bayes-calculation","expectedValue":"27/43","notes":"Normalized likelihoods are 27 and 16."},"reviewStatus":"needs-human-review"}
