{"id":"practice-rw-03","title":"Waiting for a Two-Flip Lead","difficulty":4,"mode":"practice","categories":["random-walks-stopping","recursion-state-modeling"],"techniqueVisibility":"hidden-until-solution","sequence":15,"primaryTechnique":"state-modeling","secondaryTechniques":["first-step-analysis"],"prerequisites":["first-step-analysis"],"tags":["coins","stopping-time","states"],"problem":"Flip a fair coin until heads has appeared two more times than tails, or tails has appeared two more times than heads. What is the expected number of flips?","hints":[{"level":1,"text":"Track only the current difference between head and tail counts."},{"level":2,"text":"From difference 0, one flip moves to ±1; from either ±1, the next flip either ends or returns to 0."}],"solution":{"setup":"Let E0 be expected remaining flips at difference 0 and E1 at absolute difference 1.","reasoning":"From 0, one flip always moves to absolute difference 1, so E0=1+E1. From absolute difference 1, the next flip ends with probability 1/2 and returns to 0 with probability 1/2, so E1=1+E0/2. Therefore E0=2+E0/2 and E0=4.","finalAnswer":"4 flips","sanityCheck":"The game can end in two flips, but alternating outcomes reset the difference and increase the mean above 2."},"keyInsight":"A count difference is a random walk with absorbing boundaries at ±2.","recognitionCues":["A lead changing by one after binary outcomes suggests a one-dimensional walk."],"commonMistakes":["Confusing this with waiting for two equal consecutive flips, whose expected time is 3."],"followUps":["What is the expected time to a lead of three?"],"source":{"type":"original","notes":"Original coin-lead random-walk problem."},"verification":{"status":"math-verified","method":"two-state-linear-system","expectedValue":"4","notes":"E0=1+E1 and E1=1+E0/2."},"reviewStatus":"needs-human-review"}
