{"mode":"practice","techniqueVisibility":"hidden-until-solution","secondaryTechniques":["estimation-calibration"],"prerequisites":[],"hints":[{"level":1,"text":"Both quantities equal mean divided by daily standard deviation, multiplied by sqrt(252), under these assumptions."},{"level":2,"text":"Compute (0.0008/0.012)\u00b7sqrt(252)."}],"solution":{"setup":"Annualize the daily mean-to-volatility ratio by sqrt(252).","reasoning":"The ratio is (1/15)\u00b7sqrt(252)\u22481.06. With one year of independent observations, the mean's t-statistic is the same value. A t-stat near 1 is not strong evidence against a zero true mean.","finalAnswer":"Annualized Sharpe\u22481.06; t-stat\u22481.06; evidence is weak.","sanityCheck":"A seemingly respectable Sharpe can still be statistically noisy when observed for only one year."},"keyInsight":"Sharpe magnitude and estimation uncertainty must be considered together.","recognitionCues":["A short return history asks for both performance and statistical confidence."],"commonMistakes":["Calling a Sharpe above 1 conclusive without considering sample length."],"followUps":["Approximately how many independent years would raise the t-stat to 2 if Sharpe stayed constant?"],"source":{"type":"original","notes":"Original variant of a publicly reported interview family associated with Citadel Securities, Two Sigma, Jump Trading."},"verification":{"status":"math-verified","method":"annualization-and-standard-error","expectedValue":"sqrt(252)/15\u22481.058","notes":"0.0008/0.012=1/15."},"reviewStatus":"approved","id":"firm-11","title":"Is One Year of Sharpe Convincing?","difficulty":4,"categories":["distributions-statistics","estimation-calibration"],"sequence":35,"primaryTechnique":"distributions-statistics","tags":["sharpe-ratio","significance","returns"],"employers":["Citadel Securities","Two Sigma","Jump Trading"],"problem":"A strategy has 252 independent daily returns with sample mean 0.08% and sample standard deviation 1.2%. Estimate its annualized Sharpe ratio and the t-statistic for a zero mean. Is this strong evidence of skill?"}
