{"id":"ev-03","title":"The Longer Piece","difficulty":3,"mode":"learn","categories":["expected-value","distributions-statistics"],"techniqueVisibility":"shown","sequence":3,"primaryTechnique":"basic-expected-value","secondaryTechniques":["symmetry"],"prerequisites":["basic-expected-value"],"tags":["continuous","geometry","integration"],"problem":"Break a unit-length stick at a point chosen uniformly along its length. What is the expected length of the longer piece?","hints":[{"level":1,"text":"If the break point is X, the longer piece is max(X,1-X). Use symmetry around 1/2."},{"level":2,"text":"Double the integral of 1-X over X from 0 to 1/2."}],"solution":{"setup":"Let X be the uniform break location. For X≤1/2, the longer piece has length 1-X; the other half is symmetric.","reasoning":"E[max(X,1-X)]=2∫₀^{1/2}(1-x)dx=2[x-x²/2]₀^{1/2}=2(1/2-1/8)=3/4.","finalAnswer":"3/4 of the original length","sanityCheck":"The longer piece is always between 1/2 and 1, so an expectation of 3/4 is plausible and is the midpoint of its uniform range."},"keyInsight":"Symmetry can reduce a piecewise continuous expectation to one simple integral.","recognitionCues":["A uniformly random location and a max/min payoff suggest splitting at the symmetry point."],"commonMistakes":["Using the expected break point 1/2 as the expected longer length."],"followUps":["What is the expected length of the shorter piece?"],"source":{"type":"original","notes":"Original wording of a classic random-break problem."},"verification":{"status":"math-verified","method":"exact-integration-and-symmetry","expectedValue":"3/4","notes":"Piecewise integral evaluates to 3/4."},"reviewStatus":"approved"}
