{"mode":"practice","techniqueVisibility":"hidden-until-solution","secondaryTechniques":[],"prerequisites":[],"hints":[{"level":1,"text":"Use variance w1\u00b2\u03c31\u00b2+w2\u00b2\u03c32\u00b2+2w1w2\u03c1\u03c31\u03c32."},{"level":2,"text":"The two individual variance contributions are each 0.0144 and the covariance contribution is 0.0072."}],"solution":{"setup":"Compute portfolio variance using both variances and the covariance cross term.","reasoning":"Variance=0.6\u00b2\u00b70.2\u00b2+0.4\u00b2\u00b70.3\u00b2+2\u00b70.6\u00b70.4\u00b70.25\u00b70.2\u00b70.3=0.036. Volatility is the square root.","finalAnswer":"sqrt(0.036)\u224818.97%","sanityCheck":"Diversification makes volatility lower than the weighted average volatility of 24%."},"keyInsight":"Portfolio risk depends on covariance, not just weighted individual volatilities.","recognitionCues":["Weights, volatilities, and correlation imply a quadratic variance calculation."],"commonMistakes":["Taking a weighted average of volatilities."],"followUps":["What would volatility be at correlation 1?"],"source":{"type":"original","notes":"Original variant of a publicly reported interview family associated with Citadel Securities, Two Sigma."},"verification":{"status":"math-verified","method":"portfolio-variance-formula","expectedValue":"sqrt(0.036)","notes":"Variance is exactly 0.036; square root is about 0.1897367."},"reviewStatus":"approved","id":"firm-10","title":"Risk of a Two-Asset Portfolio","difficulty":3,"categories":["distributions-statistics","markets-decision-making"],"sequence":34,"primaryTechnique":"distributions-statistics","tags":["covariance","portfolio-risk","correlation"],"employers":["Citadel Securities","Two Sigma"],"problem":"A portfolio invests 60% in an asset with 20% annual volatility and 40% in an asset with 30% volatility. Their return correlation is 0.25. What is the portfolio's annual volatility?"}
