{"id":"game-03","title":"Numbers From Either End","difficulty":3,"mode":"learn","categories":["games-optimal-strategy"],"techniqueVisibility":"shown","sequence":3,"primaryTechnique":"game-strategy","secondaryTechniques":["state-modeling"],"prerequisites":[],"tags":["minimax","backward-induction"],"problem":"The numbers 4, 7, 2, 9 lie in a row. Two players alternate taking either end number and add it to their score. Both play optimally. What should the first player take, and what final score can the first player guarantee?","hints":[{"level":1,"text":"Evaluate the game backward from shorter remaining intervals."},{"level":2,"text":"Compare taking 4 and leaving [7,2,9] with taking 9 and leaving [4,7,2], assuming the opponent then maximizes their advantage."}],"solution":{"setup":"Let D(interval) be the maximum score advantage the player to move can guarantee.","reasoning":"For [7,2,9], D=max(7-D[2,9],9-D[7,2])=max(7-7,9-5)=4. For [4,7,2], D=max(4-D[7,2],2-D[4,7])=max(4-5,2-3)=-1. From the full row, taking 4 gives advantage 4-4=0, while taking 9 gives 9-(-1)=10. Since the total is 22, advantage 10 corresponds to scores 16 and 6.","finalAnswer":"Take 9; the first player can guarantee a score of 16.","sanityCheck":"After taking 9, whatever end the opponent takes from [4,7,2], the first player can secure the remaining high value 7."},"keyInsight":"Optimal play values a move by the advantage remaining to the opponent, not by immediate payoff alone.","recognitionCues":["Two-player perfect-information optimization over a shrinking state suggests minimax backward induction."],"commonMistakes":["Greedily choosing an endpoint without evaluating the opponent's best response."],"followUps":["Can the first player always guarantee at least half the total when the row has even length?"],"source":{"type":"original","notes":"Original small minimax exercise."},"verification":{"status":"math-verified","method":"exact-minimax","expectedValue":"Take 9; score 16","notes":"Interval dynamic program yields first-player advantage 10."},"reviewStatus":"approved"}
