{
  "id":"practice-market-02","title":"The Reroll Contract","difficulty":4,"mode":"practice","categories":["markets-decision-making","expected-value","random-walks-stopping"],"techniqueVisibility":"hidden-until-solution","sequence":6,
  "primaryTechnique":"market-expected-value","secondaryTechniques":["basic-expected-value","conditional-expectation"],"prerequisites":["basic-expected-value"],"tags":["optimal-stopping","options","dice"],
  "problem":"A contract lets its owner roll a fair six-sided die. After seeing the first roll, the owner may either accept it as the dollar payoff or discard it and roll once more, in which case the second result must be accepted. What is the contract's fair value under optimal play?",
  "hints":[{"level":1,"text":"Work backward: determine the value of choosing to reroll before deciding which first rolls to keep."},{"level":2,"text":"The forced second roll is worth $3.50, so keep first results above that value and reroll results below it."}],
  "solution":{"setup":"The continuation value of rejecting the first roll is the mean of a fresh die, $3.50.","reasoning":"The owner should reroll first outcomes 1, 2, and 3, replacing each with expected value 3.5, and keep 4, 5, and 6. Therefore the contract value is [3(3.5)+4+5+6]/6 = 25.5/6 = 4.25.","finalAnswer":"$17/4, or $4.25","sanityCheck":"The option must make the contract worth more than an ordinary die's $3.50, but less than $6; $4.25 fits. Keeping 4 rather than rerolling is correct because 4 exceeds the continuation value 3.5."},
  "keyInsight":"An option should be exercised by comparing the current payoff with the expected value of continuing.","recognitionCues":["When a decision can be made after observing an outcome, calculate the continuation value first and use it as a threshold."],"commonMistakes":["Rerolling 4 because it is below the maximum payoff, rather than comparing it with the average value of the forced reroll."],"followUps":["What is the value with up to two optional rerolls?", "How does the value change if the seller controls the reroll decision?"],
  "source":{"type":"original","notes":"Original formulation of a standard dice-option problem family."},"verification":{"status":"math-verified","method":"backward-induction-and-exhaustive-policy-check","expectedValue":"17/4","notes":"Threshold policy keeps 4,5,6 and yields 25.5/6=4.25; all keep/reroll policies can be enumerated."},"reviewStatus":"needs-human-review"
}
