{
  "id":"practice-market-01","title":"The Informed Customer","difficulty":4,"mode":"practice","categories":["markets-decision-making","conditional-probability-bayes"],"techniqueVisibility":"hidden-until-solution","sequence":5,
  "primaryTechnique":"market-expected-value","secondaryTechniques":["conditional-probability"],"prerequisites":["basic-expected-value","conditional-probability"],"tags":["adverse-selection","bid-ask","information"],
  "problem":"A contract pays the result of a fair six-sided die. You quote a $3 bid and a $4 offer. A customer secretly observes the roll before trading: they buy from you at $4 only when the payoff exceeds $4, sell to you at $3 only when the payoff is below $3, and otherwise do nothing. Conditional on receiving a trade, what is your expected profit?",
  "hints":[{"level":1,"text":"A fill reveals information about which die outcomes remain possible."},{"level":2,"text":"A customer purchase implies a roll of 5 or 6; a customer sale implies a roll of 1 or 2."}],
  "solution":{"setup":"Evaluate the maker's profit conditional on each possible trade direction.","reasoning":"If the customer buys, the conditional payoff is equally likely 5 or 6, with mean $5.50. You sold at $4, so expected profit is 4-5.5=-$1.50. If the customer sells, the payoff is equally likely 1 or 2, with mean $1.50. You bought at $3, so expected profit is 1.5-3=-$1.50. Both trade directions produce the same expected loss, so conditioning only on receiving some trade also gives -$1.50.","finalAnswer":"An expected loss of $1.50 per filled trade","sanityCheck":"The customer trades only when your displayed price is favorable to them, so a positive maker profit would contradict the information advantage described."},
  "keyInsight":"A trade is itself information: conditional on being filled by an informed counterparty, the asset value is worse for the market maker than the unconditional value suggests.","recognitionCues":["When another party chooses whether to transact after observing information, condition value on their decision."],"commonMistakes":["Using the unconditional fair value of $3.50 after observing that the informed customer chose to trade."],"followUps":["Is any finite bid-ask quote profitable against this customer if they know the exact payoff?"],
  "source":{"type":"original","notes":"Original numerical adverse-selection exercise."},"verification":{"status":"math-verified","method":"conditional-case-analysis","expectedValue":"-3/2 per trade","notes":"Both buy and sell fills lose the maker 1.5 in conditional expectation."},"reviewStatus":"approved"
}
