{"id":"practice-rw-02","title":"A Gambler's Session","difficulty":4,"mode":"practice","categories":["random-walks-stopping","expected-value"],"techniqueVisibility":"hidden-until-solution","sequence":14,"primaryTechnique":"random-walks-stopping","secondaryTechniques":["first-step-analysis"],"prerequisites":["random-walks-stopping"],"tags":["gambler-ruin","stopping-time"],"problem":"A gambler starts with $3. Each fair round wins or loses $1, and play stops at $0 or $10. What is the expected number of rounds?","hints":[{"level":1,"text":"For a fair walk between 0 and N, the expected duration from i is quadratic rather than linear."},{"level":2,"text":"Verify that Ei=i(N-i) satisfies Ei=1+(E{i-1}+E{i+1})/2 and the boundary values."}],"solution":{"setup":"Let Ei be the expected duration from wealth i, with E0=E10=0.","reasoning":"The first-step recurrence is Ei=1+(E{i-1}+E{i+1})/2. The function Ei=i(10-i) satisfies both this recurrence and the boundary conditions, so uniqueness gives E3=3·7.","finalAnswer":"21 rounds","sanityCheck":"Starting near a boundary shortens the session relative to starting at 5, whose expectation would be 25."},"keyInsight":"Fair-walk expected durations solve a second-difference equation whose solution is quadratic.","recognitionCues":["An unbiased walk accumulates time until one of two absorbing wealth boundaries."],"commonMistakes":["Using the hitting probability i/N as the expected duration."],"followUps":["What is the probability the gambler reaches $10 first?"],"source":{"type":"original","notes":"Original fair gambler's-ruin duration problem."},"verification":{"status":"math-verified","method":"recurrence-verification","expectedValue":"21","notes":"i(N-i) at i=3,N=10 equals 21."},"reviewStatus":"needs-human-review"}
