{
  "id":"count-03","title":"Separating the Analysts","difficulty":3,"mode":"learn","categories":["counting-sample-spaces"],"techniqueVisibility":"shown","sequence":3,
  "primaryTechnique":"counting-combinatorics","secondaryTechniques":[],"prerequisites":["counting-combinatorics"],"tags":["arrangements","gap-method"],
  "problem":"Four distinct analysts and three distinct traders line up for a photo. How many lineups have no two analysts standing next to each other?",
  "hints":[{"level":1,"text":"Arrange the traders first and examine the gaps around them."},{"level":2,"text":"Three traders create exactly four available gaps: before, between, and after them. Each gap must receive one analyst."}],
  "solution":{"setup":"First arrange the three distinct traders, creating four gaps: _ T _ T _ T _.","reasoning":"The traders can be arranged in 3! ways. To keep analysts separated, the four distinct analysts must occupy the four gaps, one per gap, and can be assigned to those gaps in 4! ways. Therefore the number of valid lineups is 3!*4!.","finalAnswer":"144 lineups","sanityCheck":"Because there are exactly one more analysts than traders, every valid lineup must alternate and begin and end with an analyst. The analyst and trader orders can indeed be chosen independently."},
  "keyInsight":"Arrange the separating objects first, then place restricted objects into the gaps they create.","recognitionCues":["A no-adjacency restriction often becomes simple after placing the objects that act as separators."],"commonMistakes":["Choosing four of the four gaps and forgetting that distinct people can be permuted within their role positions."],"followUps":["How many valid lineups exist with four analysts and five traders?"],
  "source":{"type":"original","notes":"Original restricted-arrangement exercise."},"verification":{"status":"math-verified","method":"gap-count-and-exhaustive-permutation-check","expectedValue":"144","notes":"3!*4!=144; direct enumeration agrees."},"reviewStatus":"approved"
}
