{"id":"sym-02","title":"Partners at a Round Table","difficulty":2,"mode":"learn","categories":["symmetry-exchangeability","counting-sample-spaces"],"techniqueVisibility":"shown","sequence":2,"primaryTechnique":"symmetry","secondaryTechniques":["counting-combinatorics"],"prerequisites":["basic-probability"],"tags":["seating","adjacency"],"problem":"Eight people, including Alice and Bob, sit uniformly around a round table. What is the probability Alice sits next to Bob?","hints":[{"level":1,"text":"Fix Bob's seat; rotational arrangements do not need to be counted separately."},{"level":2,"text":"Among the seven remaining seats, exactly two are adjacent to Bob."}],"solution":{"setup":"By rotational symmetry, fix Bob and consider Alice's possible seats.","reasoning":"Alice is equally likely to occupy any of the seven other seats. Exactly two—immediately clockwise or counterclockwise from Bob—are adjacent. The probability is 2/7.","finalAnswer":"2/7","sanityCheck":"For three people the formula gives 1, since everyone is adjacent to everyone around a three-seat circle."},"keyInsight":"Fix one participant to remove irrelevant rotational symmetry, then count symmetric relative positions.","recognitionCues":["Circular seating and a question about relative position allow one person's location to be fixed."],"commonMistakes":["Using 2/8 and forgetting Alice cannot occupy Bob's seat."],"followUps":["What is the probability Alice sits directly opposite Bob?"],"source":{"type":"original","notes":"Original circular-seating exercise."},"verification":{"status":"math-verified","method":"relative-position-count","expectedValue":"2/7","notes":"Two favorable positions among seven possible positions for Alice."},"reviewStatus":"approved"}
