{"mode":"practice","techniqueVisibility":"hidden-until-solution","secondaryTechniques":[],"prerequisites":[],"hints":[{"level":1,"text":"Use five heats, then race the five heat winners to rank the heats."},{"level":2,"text":"After the winners' race, only the top three from the fastest heat, top two from the second heat, and winner of the third heat can remain candidates."}],"solution":{"setup":"Partition the runners into five heats of six and label each heat by finishing order.","reasoning":"Five heats rank runners within groups. A sixth race ranks the five winners. If A1 beats B1 beats C1, the only remaining candidates for second and third are A1,A2,A3,B1,B2,C1. Since A1 is already known fastest, race the other five once. That seventh race determines second and third.","finalAnswer":"7 races","sanityCheck":"Six races cannot suffice because after the winners' race several un-compared runners can still occupy second and third."},"keyInsight":"Each result eliminates whole dominance chains, leaving a small candidate frontier.","recognitionCues":["Ranking without times requires exploiting transitive comparisons."],"commonMistakes":["Racing only the heat winners and overlooking strong runners behind the fastest winner."],"followUps":["How many races are needed for 36 runners and six lanes?"],"source":{"type":"original","notes":"Original variant of a publicly reported interview family associated with SIG, Citadel Securities."},"verification":{"status":"math-verified","method":"constructive-elimination-and-lower-bound","expectedValue":"7","notes":"Five heats, one winners race, and one candidate race are sufficient and necessary."},"reviewStatus":"needs-human-review","id":"firm-06","title":"Thirty Runners, Six Lanes","difficulty":4,"categories":["logic-information-invariants","counting-sample-spaces"],"sequence":30,"primaryTechnique":"information-strategy","tags":["ranking","riddle","elimination"],"employers":["SIG","Citadel Securities"],"problem":"Thirty runners have distinct constant speeds. A track has six lanes and no stopwatch. What is the minimum number of races needed to identify the three fastest runners?"}
