{"mode":"practice","techniqueVisibility":"hidden-until-solution","secondaryTechniques":["basic-expected-value"],"prerequisites":[],"hints":[{"level":1,"text":"Average 1\u00b2 through 6\u00b2 to obtain fair value."},{"level":2,"text":"The sum of the first six squares is 91."}],"solution":{"setup":"The six payoffs are 1, 4, 9, 16, 25, and 36 dollars.","reasoning":"Their mean is 91/6\u224815.17. A $2-wide whole-dollar market centered near this value is $14 bid and $16 ask, which brackets fair value.","finalAnswer":"Fair value $91/6\u2248$15.17; one valid quote is $14 at $16.","sanityCheck":"The value must lie between the square of the mean, 12.25, and the maximum payoff, 36."},"keyInsight":"Price the expected payoff first; only then choose a spread around it.","recognitionCues":["A random payoff and a requested quote call for expected value plus spread construction."],"commonMistakes":["Squaring the expected die roll instead of averaging squared outcomes."],"followUps":["What changes if customers know whether the roll exceeds 4?"],"source":{"type":"original","notes":"Original variant of a publicly reported interview family associated with Jane Street, Optiver."},"verification":{"status":"math-verified","method":"exact-outcome-average","expectedValue":"91/6","notes":"(1+4+9+16+25+36)/6=91/6."},"reviewStatus":"approved","id":"firm-03","title":"Quote the Square of a Die","difficulty":3,"categories":["markets-decision-making","expected-value"],"sequence":27,"primaryTechnique":"market-expected-value","tags":["market-making","dice","fair-value"],"employers":["Jane Street","Optiver"],"problem":"A contract pays the square of a fair six-sided die roll in dollars. Find its fair value, then give a whole-dollar bid and ask exactly $2 apart that bracket the value."}
