{
  "id":"practice-count-01","title":"A Two-Pair Hand","difficulty":4,"mode":"practice","categories":["counting-sample-spaces"],"techniqueVisibility":"hidden-until-solution","sequence":1,
  "primaryTechnique":"counting-combinatorics","secondaryTechniques":["basic-probability"],"prerequisites":["counting-combinatorics"],"tags":["cards","case-counting"],
  "problem":"A five-card hand is dealt uniformly from a standard 52-card deck. What is the probability that it contains exactly two pairs?",
  "hints":[{"level":1,"text":"Describe the hand by its ranks before choosing suits."},{"level":2,"text":"Choose two ranks for the pairs, two suits for each pair, then a fifth card whose rank differs from both pair ranks."}],
  "solution":{"setup":"Count unordered five-card hands having rank pattern a,a,b,b,c with three distinct ranks.","reasoning":"Choose the two paired ranks in C(13,2) ways. Choose two of four suits for each pair in C(4,2)^2 ways. Choose the fifth rank from the remaining 11 and its suit in 4 ways. The favorable count is C(13,2)C(4,2)^2*11*4=123552. Divide by C(52,5)=2598960.","finalAnswer":"198/4165 (about 4.754%)","sanityCheck":"The count excludes full houses because the fifth rank is required to differ from both paired ranks, and it counts each two-pair hand once because the pair ranks are chosen as an unordered set."},
  "keyInsight":"For structured card hands, choose the rank pattern first and then assign suits.","recognitionCues":["The outcome is defined by repeated ranks, suggesting a rank-then-suit decomposition."],"commonMistakes":["Choosing the two pair ranks in order and double-counting every hand, or allowing the fifth card to create a full house."],"followUps":["Compare this probability with the probability of exactly three of a kind."],
  "source":{"type":"original","notes":"Original wording of a classical poker-counting family."},"verification":{"status":"math-verified","method":"combinatorial-count-and-reduction","expectedValue":"198/4165","notes":"123552/C(52,5) reduces to 198/4165."},"reviewStatus":"approved"
}
