{"mode":"practice","techniqueVisibility":"hidden-until-solution","secondaryTechniques":["first-step-analysis"],"prerequisites":[],"hints":[{"level":1,"text":"For a fair walk on 0 through N, expected duration from i is i(N\u2212i)."},{"level":2,"text":"Alternatively verify Ei=1+(E{i\u22121}+E{i+1})/2 with E0=E5=0."}],"solution":{"setup":"Use the fair gambler's-ruin duration formula with N=5 and i=2.","reasoning":"The unique solution of the first-step equations is Ei=i(5\u2212i). Therefore E2=2\u00b73.","finalAnswer":"6 moves","sanityCheck":"Starting near an edge makes the expected duration shorter than the maximum, attained near the center."},"keyInsight":"Fair absorbing-walk durations are quadratic in the starting position.","recognitionCues":["An unbiased nearest-neighbor walk stops at either of two boundaries."],"commonMistakes":["Using i/N, which is a hitting probability rather than an expected duration."],"followUps":["What is the probability the robot reaches 5 first?"],"source":{"type":"original","notes":"Original variant of a publicly reported interview family associated with IMC, Hudson River Trading."},"verification":{"status":"math-verified","method":"recurrence-verification","expectedValue":"6","notes":"i(N-i)=2*3=6."},"reviewStatus":"approved","id":"firm-07","title":"Robot Between Two Edges","difficulty":3,"categories":["random-walks-stopping","expected-value"],"sequence":31,"primaryTechnique":"random-walks-stopping","tags":["random-walk","stopping-time","recursion"],"employers":["IMC","Hudson River Trading"],"problem":"A robot occupies position 2 on the integer segment from 0 to 5. Each second it moves one unit left or right with equal probability and stops upon reaching either endpoint. What is the expected number of moves?"}
