{
  "id":"practice-logic-01","title":"One Poisoned Bottle","difficulty":4,"mode":"practice","categories":["logic-information-invariants","counting-sample-spaces"],"techniqueVisibility":"hidden-until-solution","sequence":3,
  "primaryTechnique":"information-strategy","secondaryTechniques":["counting-combinatorics"],"prerequisites":[],"tags":["binary-encoding","information","riddle"],
  "problem":"Exactly one of 1,000 bottles is poisoned. You have 10 test strips and may place drops from any bottles on each strip. After one simultaneous round, each strip reports only positive or negative. How can you identify the poisoned bottle?",
  "hints":[{"level":1,"text":"Ten binary outcomes can encode more than 1,000 distinct identities."},{"level":2,"text":"Number the bottles and associate each test strip with one bit of the bottle number."}],
  "solution":{"setup":"Number bottles 0 through 999 and write each number as a 10-bit binary string.","reasoning":"For each bottle, place a drop on exactly those strips corresponding to 1-bits in its binary label. After testing, interpret positive strips as 1 and negative strips as 0. The resulting 10-bit pattern is precisely the poisoned bottle's label. Ten strips distinguish 2^10=1024 patterns, enough for 1,000 bottles.","finalAnswer":"Use the strips as the ten bits of a binary code; the positive/negative pattern identifies the bottle in one round.","sanityCheck":"Because 2^9=512<1000, nine binary strips could not guarantee identification, while ten can."},
  "keyInsight":"Parallel yes/no tests can encode candidate identities rather than testing candidates individually.","recognitionCues":["A one-round identification problem with binary outcomes suggests binary encoding."],"commonMistakes":["Dividing bottles into only ten disjoint groups, which identifies a group but not a bottle."],"followUps":["How many bottles can 12 strips distinguish?", "How would a delayed or unreliable positive result change the design?"],
  "source":{"type":"original","notes":"Original formulation of a standard binary-testing puzzle family."},"verification":{"status":"math-verified","method":"constructive-code-and-information-bound","expectedValue":"10 strips distinguish up to 1024 bottles","notes":"Every bottle receives a unique 10-bit code."},"reviewStatus":"needs-human-review"
}
